Name,Category,Address,Description,Price,Tips
Calém,Port Wine Lodge,"Av. Diogo Leite 344, Vila Nova de Gaia, Porto",Most-visited lodge. Sensory barrel museum + optional Fado show. Best for first-timers and families.,From €22,Book online; Fado combo €28
Graham's,Port Wine Lodge,"Rua do Agro 141, Vila Nova de Gaia, Porto","Founded 1820. Hilltop panoramic views, leather-chaired Vintage Room. Most thorough wine education.",From €30–40,Vintage Room €60–70; premium + cheese pairing €40
Poças,Port Wine Lodge,"Rua Visconde das Devesas 224, Vila Nova de Gaia, Porto","Rare Portuguese family-owned lodge (1918). Intimate, personal. Best for aged Tawny Colheitas.",From €23,Book ahead; family-owned since 1918
Cockburn's,Port Wine Lodge,"Rua Serpa Pinto 346, Vila Nova de Gaia, Porto",Largest wooden cellar in Gaia. Only lodge with a working cooperage — watch barrel-making by hand.,From €26,John Smith's Room premium tasting €50–75
Quevedo,Port Wine Wine Lodge,"Rua de Santa Marinha 77, Vila Nova de Gaia, Porto","Young family-run producer in a 200yr-old cooperage. Communal tables, wine bar, cheese pairings.",From €12,Port + 3 cheeses pairing €26; book ahead
Taylor's,Port Wine Lodge,"Rua do Choupelo 250, Vila Nova de Gaia, Porto","One of oldest houses (1692). Hilltop gardens, peacock, self-guided audio tour in 13 languages.",€25,Best for families; gardens are spectacular
Burmester,Port Wine Lodge,"Largo Ponte Luiz I, Vila Nova de Gaia, Porto","Most conveniently located — right at foot of Dom Luís I Bridge. Smallest, least crowded riverfront lodge.",From €23,3 aged Ports + cheese + chocolate €45
Ferreira,Port Wine Lodge,"Av. Ramos Pinto 70, Vila Nova de Gaia, Porto",Most culturally Portuguese lodge. Built into a convent. Legacy of Dona Antónia Adelaide Ferreira.,From €23,Book via ferreira.visitors@aaferreira.pt
Quinta do Noval,Port Wine Lodge,"Av. de Diogo Leite 256, Vila Nova de Gaia, Porto","Walk-in wine shop/bar. No cellar tour. Great Douro views, Vintage + Ruby + Tawny flights.",€28–50,No booking needed; walk in
Café Santiago,Francesinha,"Rua Passos Manuel 226, Porto",Porto's most iconic francesinha institution (est. 1959). Proprietary family sauce. Arrive before noon.,€9.50–12,Arrive before noon to avoid queue; order Francesinha à Santiago
Yuko Tavern,Francesinha,"Rua de Costa Cabral 2331, Porto","Evening-only, reservations needed. Oven-baked francesinha and best sangria in Porto.",~€13,Book ahead; dinner only; half-portion available
Brasão Cervejaria,Francesinha,"Rua Ramalho Ortigão 28, Porto","Polished beer house. Broader menu with craft beers, vegetarian options. Good for mixed groups.",~€12,Two Porto locations; same group as Yuko
Lado B Café,Francesinha,"Rua Passos Manuel 190–192, Porto",Music-themed cervejaria opposite the Coliseu. Solid francesinha. Famous chocolate cake.,~€10.65,Order the chocolate cake for dessert
Tappas Caffé,Francesinha,"Rua António Granjo 549, Vila Nova de Gaia, Porto",Rare wood-burning oven francesinha — genuine grilled cheese. Spicy 'men's sauce' option. Free xiripiti shot.,~€11,Ask for spicy sauce; free shot included
Santa Francesinha,Francesinha,"Praça dos Poveiros 72, Porto",8 types including Porto's best vegan francesinha (seitan + soy chorizo + vegan sauce).,~€11,Best vegan francesinha in Porto
Cufra,Francesinha,"Avenida da Boavista 2504, Porto",Sauce descended from Regaleira — the very first Porto francesinha restaurant. Secret formula known by 3 people.,~€12,Est. 1974; legendary secret sauce
Venham Mais 5,Francesinha,"Rua de Santo Ildefonso 219, Porto","Excellent meat, well-spiced sauce, exceptional hand-cut fries. Lively spot near Praça dos Poveiros.",~€10,Order the hand-cut fries; chocolate mountain dessert
Capa Negra II,Francesinha,"Rua do Campo Alegre 191, Porto","Porto's most beloved brewery, perpetually buzzing with locals. Famous city-wide for rissóis (fried dumplings).",~€10,Order rissóis as starter
A Cantarinha Café,Francesinha,"Largo da Maternidade de Júlio Dinis 75, Porto",Family-run neighbourhood café. Owner refills your table with house-fried chips — whether you ask or not.,€7–8,Best value francesinha in Porto; cash preferred
Francesinha Café,Francesinha,"Rua da Alegria 946, Porto","Specialist francesinha-only diner. Outstanding quality, rotating surprise topping each visit.",~€11,Reservations recommended; always full
Casa de Pasto O Golfinho,Francesinha,"Rua de Sá de Noronha 137, Porto",Tiny cash-only hole-in-the-wall. Most authentic experience. Cash only — no cards.,~€9,Cash only; no reservations
Madureira's,Francesinha,"Rua do Campo Alegre 359–365, Porto",Est. 1969. Mild non-spicy francesinha sauce — preferred by those who don't want heat.,~€10,Good if you prefer mild sauce
Escama,Seafood,"Rua de Mouzinho da Silveira 203, Porto","Modern sophisticated seafood. Creative Atlantic cuisine, turbot with hazelnut vinaigrette.",€24–35/person,Book 1 week ahead; turbot is the signature dish
Culto ao Bacalhau,Seafood,"Rua Formosa 322 (Mercado do Bolhão), Porto",Michelin-recommended codfish specialist inside Bolhão Market. 20+ cod preparations.,€30–45/person,Roasted cod with corn bread crust is the standout
Taberna dos Mercadores,Seafood,"Rua dos Mercadores 36, Porto",Tiny 16-seat gem in Ribeira. Weeks-in-advance reservations. Best octopus rice in Porto.,€25–35/person,Email ahead; only 16 seats; octopus rice is unmissable
Terra Nova,Seafood,"Cais da Ribeira 34, Porto",Polished brasserie-style on Ribeira waterfront. Large Douro-view windows. Good for lunch with views.,€15–30/person,Walk-in; good terrace views of the Douro
Ostras & Coisas,Seafood,"Rua da Fábrica 73, Porto",Long-standing reference for fresh oysters and shellfish. Outstanding sparkling wine list.,€20–35/person,Fresh oysters + Mix shellfish platter are the orders
Meia Nau Porto,Seafood,"Travessa de Cedofeita 48, Porto","City-centre branch of Matosinhos institution. Nautical-themed, fast efficient service.",€15–25/person,Traditional fish & bread stew is the signature
Bacalhau,Seafood,"Rua Muro dos Bacalhoeiros 153, Porto",Tiny restaurant on ancient river wall of Ribeira. Most authentic atmosphere in the area.,€20–30/person,Creative codfish in all forms; great Douro atmosphere
Terreiro,Seafood,"Largo do Terreiro 11–12, Porto",Small restaurant with fantastic Douro views. Generous food at fair prices. Arrive at opening.,€15–25/person,Arrive at opening or book; seafood rice + garlic prawns
Marisqueira do Porto,Seafood,"Rua do Campo Alegre 110, Porto",Relaxed neighbourhood marisqueira. Fair prices. Good for mixed groups (also serves francesinha).,€15–25/person,Roasted octopus is the standout
O Gaveto,Seafood,"Rua Roberto Ivens 826, Matosinhos, Porto",The quintessential Porto seafood answer. Matosinhos institution since 1984. Krug Ambassade 2025. The splurge.,€35–55/person,Book 1 week ahead; order from the fish display
Restaurante Lusíadas,Seafood,"Rua de Tomaz Ribeiro 257, Matosinhos, Porto","Premium 3-generation family restaurant. Michelin-recommended, sommelier, best wine list in Matosinhos.",€40–60/person,Book ahead; stuffed crab and arroz de marisco are outstanding
Salta o Muro,Seafood,"Rua Heróis de França 386, Matosinhos, Porto","No-frills Matosinhos staple. Plastic chairs, sharing tables. True local experience.",€15–25/person,Octopus rice on Fridays; grilled sardines when seasonal
Mercado – Food & Drinks,Seafood,"Rua França Júnior 15, Matosinhos, Porto","Unique concept: pick your fish at market stalls, fishmongers prep it, restaurant cooks it.",€12–20/person,Notably reasonable vs the Rua Heróis strip
Jácome,Seafood,"Rua Vareiro 141, Leça da Palmeira, Porto",Dark no-frills restaurant. Powerful smell of fish = authenticity. Serious destination for flavour.,€15–25/person,Fresh grilled fish (daily catch); octopus rice
O Filipe de Angeiras,Seafood,"Avenida Praia de Angeiras 160, Lavra, Porto",One of very few restaurants with a terrace directly facing the Atlantic. Enormous starters list.,€15–25/person,Grilled sardines; clams à Bolhão Pato; order Muros Antigos vinho verde
Confeitaria do Bolhão,Breakfast / Café,"Rua Formosa 339, Porto",Porto's oldest pastry shop (est. 1896). Beautiful Art Nouveau interior. Opens 6am — good for departure day.,Budget (nata €1.20),Opens 6am; pastel de nata + galão; gorgeous interior
Leitaria da Quinta do Paço,Breakfast / Café,"Praça Guilherme Gomes Fernandes 47–51, Porto",Historic dairy-turned-pastry shop (1920s). Famous for artisanal whipped-cream eclairs in 8 flavours.,€3.90–5.90,Whipped-cream eclairs are the signature; 4 Porto locations
Molete Bread & Breakfast,Breakfast / Café,"Rua do Heroísmo 205, Porto",Local bakery chain. Budget-friendly breakfast menus from €1. Bôla saloia (savoury Portuguese cake) is the highlight.,From €1,Multiple locations; bôla saloia + pastel de nata
Confeitaria Chicana,Breakfast / Café,"Avenida de Rodrigues de Freitas 36, Porto",Family-run pastry shop in Bonfim. Won Sábado magazine's Best Croissant in Porto. Entirely local crowd.,Budget,Award-winning croissants; húngaros biscuits
SO Coffee Roasters,Breakfast / Café,"Rua Sá de Noronha 119, Porto","Small specialty coffee bar. Choose brew method (Chemex, V60, AeroPress) and single-origin bean. For coffee geeks.",Moderate,Single-origin filter prepared to order; largely unknown even to locals
DaTerra Baixa,Breakfast / Café,"Rua de Mouzinho da Silveira 249, Porto",Porto's go-to vegan breakfast. Full buffet Mon–Fri 08:30–11:30. Vegan pastéis de nata.,Moderate,Vegan; buffet weekday mornings only
Época Porto,Breakfast / Café,"Rua do Rosário 22, Porto",Tiny Nordic-inspired café. Seasonal organic ingredients. Always a queue — arrive early. Worth the wait.,Higher,Arrive before 9am; sourdough toast; organic seasonal plates
Hakko,Breakfast / Café,"Rua do Rosário 313, Porto",Seasonal breakfast/brunch café by a former Época owner. La Cabra specialty coffee. Brilliant croissants.,Moderate,Croissants + Turkish eggs + French toast; arrive early
BICHO Porto,Breakfast / Café,"Rua do Breiner 72, Porto",Sun-drenched plant-filled café. Rotating monthly French toast (rabanada) — new flavour every month.,Moderate,Monthly rotating rabanada is the signature; social mixing spot
Early (Cedofeita),Breakfast / Café,"Rua dos Bragas 374, Porto","Sustainability-focused brunch café in artsy Cedofeita. Seasonal, locally sourced, house-baked artisan bread.",Moderate,Outstanding food; carob & almond brownie; atmosphere noted as slightly snobbish
A Certain Café,Breakfast / Café,"Rua do Morgado de Mateus 107, Porto","Drip-coffee-only specialty café — no espresso menu. Vegetable-forward, sourdough toast. Away from tourist crowds.",Moderate,No espresso; filter coffee only; slow unhurried breakfast
Royale Pão Paixão,Breakfast / Café,"Rua Guerra Junqueiro 634, Porto","Modern artisan bakery-café in Boavista. Sourdough, pastries, bright dining room. Lunch Mon–Fri.",Moderate,Banana bread; pastéis de nata; croissants
A Bolacheira,Breakfast / Café,"Rua Carvalho 102A, Porto",Porto's only café specialising exclusively in cookies and cupcakes. Quiet Foz street. Everything homemade daily.,From €1.90,Red velvet cupcake; rotating flavours; very affordable
Pão – Padaria Artesanal,Breakfast / Café,"Rua de Diu 365 (Mercado da Foz), Porto",Artisan bakery stall inside Foz market near the ocean. Organic flours. Savoury toast with Portuguese canned fish.,Moderate,Savoury canned fish toast is unique; organic sourdough
Manteigaria,Breakfast / Café,"Rua Alexandre Herculano 56, Porto","Reddit's unanimous #1 for standalone pastéis de nata in Porto. Standing counter, piping hot from the oven. ~€1.30.",Budget (~€1.30),Standing counter only; eat immediately; pair with bica
Fábrica da Nata,Breakfast / Café,"Rua de Santa Catarina 225, Porto","Reliable, less touristy nata café. Consistent quality without hype or queues. ~€1.30.",Budget (~€1.30),Multiple locations; reliable quality; less crowded than Manteigaria
Aloma,Breakfast / Café,"Porto Airport + city locations, Porto",Award-winning pastel de nata 2024–2025. Airport location ideal on departure day. Richer egg-forward custard. ~€1.50.,~€1.50,Best nata 2024–25; Porto Airport location for departure day
Tabuleta,Dinner / Lunch,"Rua da Conceição area, Porto","Classic Portuguese tasca — honest, generous, no shortcuts. The kind of neighbourhood restaurant locals eat at for decades.",€20–30/person,Walk-in; arrive by 7pm; generous portions
MUU,Dinner / Lunch,"Porto city centre, Porto","Contemporary Portuguese with strong focus on quality beef and seasonal local produce. Sleek interior, serious kitchen.",€25–35/person,Reservations essential — book 1–2 weeks ahead
Eleit,Dinner / Lunch,"Porto city centre, Porto",Relaxed modern local cuisine. Good value for the quality. Popular with young Porto professionals.,~€22/person,Recommended to book; creative daily menu
Taberna de São Miguel,Dinner / Lunch,"Near Igreja de São Miguel, Porto",Traditional petiscos bar. Try tripas à moda do Porto — the dish that earned locals the nickname tripeiros.,€15–22/person,Walk-in or call ahead; tripas à moda do Porto is the must-order
Restaurante O Rafael,Dinner / Lunch,"Matosinhos beach area, Matosinhos, Porto",Beloved local institution steps from Matosinhos beach. Grilled fish bought fresh that morning. Kids love it.,€12–18/person,Walk-in; arrive before noon or 7pm; fishermen's catch daily
Loca,Dinner / Lunch,"Porto city centre, Porto","Porto's most talked-about creative seafood 2025–26. Small, exclusive, chef-driven. Book 2–3 weeks ahead.",€35–45/person,Book 2–3 weeks ahead — essential in August
Cobre,Dinner / Lunch,"Vila Nova de Gaia (near Dom Luís I Bridge), Porto",Contemporary Portuguese in Gaia with terrace offering bridge views over Porto. Ideal for a special dinner.,€35–45/person,Book in advance; aged cod + octopus with sweet potato
Casa da Bifana,Snacks,"Near Rua de Passos Manuel, Porto","Porto's iconic bifana stop — pork cutlet in a crusty roll with garlicky wine sauce. Cheap, fast, open late.",€2–4,Eat immediately while hot; cash preferred; open late
Picha Café,Bar,"Rua da Conceição, Porto",Young locals' favourite bar. Good cocktails at reasonable prices. Where Porto twenty-somethings start their evenings.,€5–8,"Relaxed, casual, local crowd; good house cocktails"
Base,Bar,"Near São Bento station, Porto","Cocktail bar near São Bento. Consistently well-executed drinks. Good music, compact space.",€7–10,Craft cocktails; neighbourhood bar feel
Bar Clássico,Bar,"Near Rua dos Poveiros, Porto","Old-school Portuguese bar unchanged in 30 years. Cheap, authentic, local regulars. Near the hotel.",€1.50–4,House wine €1.50/glass; dirt cheap and utterly authentic
The Yeatman (terrace bar),Bar,"Rua do Choupelo 88, Vila Nova de Gaia, Porto",Luxury hotel in Gaia with the most spectacular panoramic view of Porto. Open to non-guests. Splurge-worthy.,€15–25/flight,Arrive before sunset; wine flights €15–25; open to non-guests
