Name,Category,Type,Address,Cost Range,Tips,Website
Manteigaria (Chiado),Breakfast,Nata Bar,"Rua do Loreto 2, 1200-241 Lisboa","1.30 EUR/nata","Standing counter. Watch the natas come out of the oven through the glass.",https://www.manteigaria.com/en/
Convento do Carmo,Sight,Ruins / Museum,"Largo do Carmo, 1200-092 Lisboa","7 EUR (free w/ Lisboa Card)","1755 earthquake ruins, nave open to the sky. Closed Sundays.",https://www.museuarqueologicodocarmo.pt/info_en.html
Elevador de Santa Justa,Sight,Landmark,"R. do Ouro, 1150-060 Lisboa","5.30 EUR round trip","Cast-iron 1902 lift. Viewing deck over Rossio and the Carmo ruins.",https://www.carris.pt/en/elevadores/
LX Factory,Sight,Creative District,"Rua Rodrigues de Faria 103, 1300-501 Lisboa",Free,"Industrial complex turned creative hub. Ler Devagar bookshop has the flying bicycle.",https://www.lxfactory.com/
Time Out Market Lisboa,Lunch,Food Market,"Av. 24 de Julho 49, 1200-479 Lisboa","10-20 EUR/person","Fallback lunch spot before the airport run.",https://www.timeout.com/time-out-market-lisboa
Museu do Chiado,Sight,Contemporary Art Museum,"Rua Serpa Pinto 4-6, 1200-444 Lisboa","FREE with Lisboa Card","Right in the neighbourhood you're already walking - zero detour.",https://www.museuartecontemporanea.gov.pt/en/
Museu da Guarda Nacional Republicana,Sight,Museum,"Largo do Carmo 2, 1200-092 Lisboa","FREE with Lisboa Card","Same square as Convento do Carmo - historic Carmo Barracks, site of the 1974 Carnation Revolution surrender. Verify opening hours.",N/A
Museum of Illusions Lisboa,Sight,Interactive Museum,"Rua Augusta 39, 1100-053 Lisboa","-20% with Lisboa Card (discount only, not free)","On the Rua Augusta route in Baixa/Chiado.",https://www.museumofillusions.pt
