Name,Category,Type,Address,Cost Range,Tips,Website
Calém,Port Wine Lodge,Wine Tasting,"Av. Diogo Leite 344, 4400-111 Vila Nova de Gaia, Porto",From €22,"Sensory barrel museum, optional Fado show combo. Best for first-timers. Combo: cellar + Live Fado + tasting €28",https://www.calem.pt
Graham's,Port Wine Lodge,Wine Tasting,"Rua do Agro 141, 4400-003 Vila Nova de Gaia, Porto",From €30–40,"Hilltop panoramic views, leather-chaired Vintage Room (€60–70). Most thorough wine education. Premium + cheese/chocolate pairing €40",https://www.grahams-port.com
Poças,Port Wine Lodge,Wine Tasting,"Rua Visconde das Devesas 224, 4401-337 Vila Nova de Gaia, Porto",From €23,"Rare Portuguese family-owned lodge (since 1918). Intimate and personal. Aged Tawny Colheitas are the specialty",https://www.pocas.pt
Cockburn's,Port Wine Lodge,Wine Tasting,"Rua Serpa Pinto 346, 4400-307 Vila Nova de Gaia, Porto",From €26,"Largest wooden Port cellar in Gaia. Only lodge with a working cooperage — watch coopers repair barrels by hand. John Smith's Room premium tasting €50–75",https://www.cockburns.com/visitus
Quevedo,Port Wine Lodge,Wine Tasting,"Rua de Santa Marinha 77, 4400-291 Vila Nova de Gaia, Porto",From €12,"Young family-run producer (1993) in a 200-year-old cooperage. Communal tables, wine bar + cocktails. Port + 3 cheeses pairing €26",https://www.quevedo.pt
Taylor's,Port Wine Lodge,Wine Tasting,"Rua do Choupelo 250, 4400-088 Vila Nova de Gaia, Porto",From €25,"One of oldest Port houses (1692). Hilltop gardens, peacock, self-guided audio tour (13 languages). Best scenic spot in Gaia",https://www.taylor.pt
Burmester,Port Wine Lodge,Wine Tasting,"Largo Ponte Luiz I, 4400-111 Vila Nova de Gaia, Porto",From €23,"Most conveniently located — right at foot of Dom Luís I Bridge. Small, less crowded. Aged Tawnies are the house specialty. 3 aged Ports + cheese + chocolate €45",https://www.burmester.pt
Ferreira,Port Wine Lodge,Wine Tasting,"Av. Ramos Pinto 70, 4400-082 Vila Nova de Gaia, Porto",From €23,"Founded 1751, built into an old convent. Most culturally Portuguese lodge. Legacy of Dona Antónia Adelaide Ferreira. Book via ferreira.visitors@aaferreira.pt",https://winetourism.sogrape.com/en/visit/ferreira
Quinta do Noval,Port Wine Lodge,Wine Tasting,"Av. de Diogo Leite 256, 4400-111 Vila Nova de Gaia, Porto",€28–50,"Walk-in wine shop/bar — no cellar tour. Great Douro views. Vintage + Ruby + 20-Year and 40-Year Tawny flights. No booking needed",https://www.quintadonoval.com/en/wine-shops
Café Santiago,Francesinha,Sandwich,"Rua Passos Manuel 226, 4000-382 Porto",€9.50–12,"Porto's most iconic francesinha institution (est. 1959). Proprietary family sauce since 1959. Arrive before noon to avoid queues",https://cafesantiago.pt/en/
Yuko Tavern,Francesinha,Sandwich,"Rua de Costa Cabral 2331, 4200-232 Porto",~€13,"Evening-only, reservations needed. Oven-baked francesinha. Best sangria in Porto. Half-portion available",https://www.yuko.com.pt/
Brasão Cervejaria,Francesinha,Sandwich,"Aliados: Rua Ramalho Ortigão 28 / Coliseu: Rua Passos Manuel 205, Porto",~€12,"Polished rustic-chic beer house. Craft beers, vegetarian options. Good for mixed groups. Same group as Yuko",https://brasao.pt/en/
Lado B Café,Francesinha,Sandwich,"Rua Passos Manuel 190–192, 4000-382 Porto",~€10.65,"Music-themed cervejaaria opposite the Coliseu. Famous chocolate cake (reportedly 'best in the world')",https://ladobcafe.pt/
Tappas Caffé,Francesinha,Sandwich,"Rua António Granjo 549, Candal, 4440-452 Vila Nova de Gaia",~€11,"Rare wood-burning oven francesinha — genuine grilled cheese. Spicy 'men's sauce' option. Free xiripiti shot included",https://www.tappascaffe.pt/
Santa Francesinha,Francesinha,Sandwich,"Praça dos Poveiros 72, Porto",~€11,"8 types including Porto's best vegan francesinha (seitan + soy chorizo + vegan sauce). Short wait likely",https://www.santafrancesinha.pt/
Cufra,Francesinha,Sandwich,"Avenida da Boavista 2504, 4100-119 Porto",~€12,"Est. 1974 — one of Porto's oldest. Sauce descended from Regaleira (the very first francesinha restaurant). Only 3 people know the recipe",https://www.cufra.pt/
Venham Mais 5,Francesinha,Sandwich,"Rua de Santo Ildefonso 219, 4000-470 Porto",~€10,"Originally Porto's top prego destination. Francesinha earns equal acclaim. Exceptional hand-cut fries. Chocolate mountain dessert",https://venham-mais-5-o-original.business.site/
Capa Negra II,Francesinha,Sandwich,"Rua do Campo Alegre 191, 4150-177 Porto",~€10,"Porto's most beloved brewery, perpetually buzzing with locals. Famous city-wide for rissóis (fried dumplings). Soft-style sauce",http://www.capanegra.com/
A Cantarinha Café,Francesinha,Sandwich,"Largo da Maternidade de Júlio Dinis 75, 4050 Porto",€7–8,"Family-run neighbourhood café. Owner refills your table with house-fried chips — whether you ask or not. Warm and unfussy",N/A
Francesinha Café,Francesinha,Sandwich,"Rua da Alegria 946, Porto",~€11,"Specialist francesinha-only diner near Marquês metro. Outstanding quality, rotating surprise topping each visit. Small and always full",https://francesinha-cafe.weeblyte.com/
Casa de Pasto O Golfinho,Francesinha,Sandwich,"Rua de Sá de Noronha 137, 4050-526 Porto",~€9,"Tiny cash-only hole-in-the-wall. Sparkling clean, wildly popular with locals. One of Porto's most authentic experiences. Cash only",N/A
Madureira's,Francesinha,Sandwich,"Rua do Campo Alegre 359–365, Porto",~€10,"Est. 1969. Multi-location seafood-first group where the francesinha holds its own. Kitchen dials back heat — smooth, non-spicy sauce",https://www.madureiras.pt/
Escama,Seafood,Restaurant,"Rua de Mouzinho da Silveira 203, 4050-421 Porto",€24–35/person,"Modern sophisticated contemporary seafood. Creative Atlantic cuisine. Turbot with hazelnut vinaigrette is the standout. Book 1 week ahead",https://escamaporto.com/en/
Culto ao Bacalhau,Seafood,Restaurant,"Mercado do Bolhão, Rua Formosa 322, 4000-248 Porto",€30–45/person,"Michelin-recommended codfish specialist inside Bolhão Market. 20+ cod preparations. Roasted cod with corn bread crust is the standout. Book ahead",https://cultoaobacalhau.pt/en/
Taberna dos Mercadores,Seafood,Restaurant,"Rua dos Mercadores 36, 4050-126 Porto",€25–35/person,"Tiny 16-seat gem in Ribeira. Weeks-in-advance reservations essential. Best octopus rice in Porto. Email ahead",https://tabernadosmercadores.com/
Terra Nova,Seafood,Restaurant,"Cais da Ribeira 34, 4050-509 Porto",€15–30/person,"Polished brasserie-style on Ribeira waterfront. Large Douro-view windows. Good refined lunch or dinner with river views. Walk-in",https://terranovarestaurante.pt/
Ostras & Coisas,Seafood,Restaurant,"Rua da Fábrica 73, 4050-245 Porto",€20–35/person,"Long-standing reference for fresh oysters and shellfish. Outstanding sparkling wine list. Fresh oysters + Mix shellfish platter",https://ostrasecoisas.pt/
Meia Nau Porto,Seafood,Restaurant,"Travessa de Cedofeita 48, 4050-183 Porto",€15–25/person,"City-centre branch of beloved Matosinhos institution. Nautical-themed, fast service. Traditional fish & bread stew (galo frito com açorda de ovas)",https://www.meianaurestaurante.com/en
Bacalhau,Seafood,Restaurant,"Rua Muro dos Bacalhoeiros 153, 4050-080 Porto",€20–30/person,"Small intimate restaurant on ancient Ribeira river wall. Most authentic atmosphere in the area. Creative codfish in all forms",N/A
Terreiro,Seafood,Restaurant,"Largo do Terreiro 11–12, 4050-603 Porto",€15–25/person,"Small popular restaurant with fantastic Douro views. Generous food at fair prices. Arrive at opening or book",N/A
Marisqueira do Porto,Seafood,Restaurant,"Rua do Campo Alegre 110, 4150-168 Porto",€15–25/person,"Relaxed neighbourhood marisqueira in Campo Alegre. Fair prices. Also serves francesinha — good for mixed groups",N/A
O Gaveto ⭐,Seafood,Restaurant,"Rua Roberto Ivens 826, 4450-255 Matosinhos",€35–55/person,"The quintessential answer to 'best seafood in Porto.' Matosinhos institution since 1984. Krug Ambassade distinction 2025. The splurge. Order from the display",https://ogaveto.com/
Restaurante Lusíadas,Seafood,Restaurant,"Rua de Tomaz Ribeiro 257, 4450-297 Matosinhos",€40–60/person,"Premium three-generation family restaurant. Michelin-recommended, sommelier, curated wine list. Stuffed crab and arroz de marisco are outstanding. Book ahead",https://www.restaurantelusiadas.com/
Salta o Muro,Seafood,Restaurant,"Rua Heróis de França 386, 4450-155 Matosinhos",€15–25/person,"No-frills Matosinhos staple — plastic chairs, sharing tables. True local experience. Octopus rice on Fridays; seasonal grilled sardines",N/A
Mercado – Food & Drinks,Seafood,Restaurant,"Rua França Júnior 15, 4450-135 Matosinhos",€12–20/person,"Unique concept: pick your fish at market stalls, fishmongers prep it, restaurant cooks it. Notably reasonable vs the Rua Heróis strip",https://www.mercadofooddrinks.com/en/mercado-comida-en/
Jácome,Seafood,Restaurant,"Rua Vareiro 141, 4450-718 Leça da Palmeira",€15–25/person,"Dark no-frills restaurant past Matosinhos. Powerful smell of fish signals authenticity. Serious destination for flavour above everything else",N/A
O Filipe de Angeiras,Seafood,Restaurant,"Avenida Praia de Angeiras 160, 4455-188 Lavra (near Matosinhos)",€15–25/person,"One of very few restaurants with a terrace directly facing the Atlantic. Enormous starters list, festive vibe. Order Muros Antigos vinho verde",N/A
Confeitaria do Bolhão,Breakfast / Café,Pastry,"Rua Formosa 339, 4000-252 Porto",Budget (~€1.20/nata),"Porto's oldest pastry shop (est. 1896). Beautiful Art Nouveau interior opposite Bolhão market. Opens 6am — great for departure day",https://www.confeitariadobolhao.com/en/
Leitaria da Quinta do Paço,Breakfast / Café,Café,"Praça Guilherme Gomes Fernandes 47–51, Porto",€3.90–5.90,"Historic dairy-turned-pastry shop (1920s). Famous for artisanal whipped-cream éclairs in 8 fixed flavours + seasonal varieties. Breakfast menus from €3.90",https://leitariadaquintadopaco.com/?lang=en
Molete Bread & Breakfast,Breakfast / Café,Bakery,"Rua do Heroísmo 205, 4300-253 Porto",From €1,"Local bakery mini-chain. Budget-friendly breakfast menus from €1. Bôla saloia (traditional savoury Portuguese cake) is the standout",https://moletebreadandbreakfast.eatbu.com/
Confeitaria Chicana,Breakfast / Café,Pastry,"Avenida de Rodrigues de Freitas 36, 4300-096 Porto",Budget,"Family-run pastry shop in Bonfim. Won Sábado magazine's Best Croissant in Porto. Entirely local crowd. Award-winning croissants + húngaros biscuits",https://www.confeitariachicana.pt/
SO Coffee Roasters,Breakfast / Café,Coffee,"Rua Sá de Noronha 119, Porto (Aliados area)",Moderate,"Small bright specialty coffee bar. Choose your brew method (Chemex, V60, AeroPress) and single-origin bean. For coffee geeks. Largely unknown even to locals",https://soroasters.com/
DaTerra Baixa,Breakfast / Café,Vegan,"Rua de Mouzinho da Silveira 249, 4050-421 Porto",Moderate,"Porto's go-to vegan breakfast. Full buffet Mon–Fri 08:30–11:30. Vegan pastéis de nata, açaí bowls, detox juices. Modern stylish setting near São Bento",https://daterra.pt/
Época Porto,Breakfast / Café,Café,"Rua do Rosário 22, 4050-522 Porto",Higher,"Tiny Nordic-inspired café. Seasonal organic ingredients. Always a queue — arrive early. Sourdough toast; organic seasonal plates. Worth the wait",http://epocaporto.com/
Hakko,Breakfast / Café,Café,"Rua do Rosário 313, Porto",Moderate,"Seasonal breakfast/brunch café by a former Época owner. La Cabra (Copenhagen) specialty coffee. Brilliant croissants ('to die for'), Turkish eggs, French toast. Arrive early",https://www.instagram.com/hakko_house_/
BICHO Porto,Breakfast / Café,Café,"Rua do Breiner 72, 4050-172 Porto",Moderate,"Sun-drenched plant-filled café with a full glass wall. Rotating monthly French toast (rabanada) — new flavour every month. Social mixing point for locals and expats",https://obicho.pt/
Early (Cedofeita),Breakfast / Café,Brunch,"Rua dos Bragas 374, 4050-122 Porto",Moderate,"Sustainability-focused breakfast/brunch café in artsy Cedofeita. Seasonal, locally sourced, house-baked artisan bread. Outstanding food; atmosphere slightly snobbish",https://www.early.pt/
A Certain Café,Breakfast / Café,Coffee,"Rua do Morgado de Mateus 107, 4000-333 Porto",Moderate,"Drip-coffee-only specialty café — no espresso menu. Vegetable-forward menu, sourdough toast. Perfect for slow unhurried breakfast away from tourist crowds",https://www.a-certain.com/pages/contactos-direct
Royale Pão Paixão,Breakfast / Café,Bakery,"Rua Guerra Junqueiro 634, Porto",Moderate,"Modern artisan bakery-café in Boavista. Sourdough, pastries, bright dining room. Heavy on sweet options. Lunch Mon–Fri, brunch Sat. Banana bread, pastéis de nata",https://www.instagram.com/royale_pao_paixao/
A Bolacheira,Breakfast / Café,Café,"Rua Carvalho 102A, 4150-192 Porto (Foz)",From €1.90,"Porto's only café specialising exclusively in cookies and cupcakes. Quiet Foz street. Everything homemade fresh daily, rotating creative flavours. Very affordable",http://www.abolacheira.pt/
Pão – Padaria Artesanal,Breakfast / Café,Bakery,"Rua de Diu 365 (Mercado da Foz, Foz do Douro)",Moderate,"Artisan bakery stall inside Foz market near the ocean. Organic flours, slow fermentation. Savoury toast with Portuguese canned fish is unique. Sourdough with local roaster coffee",https://www.padariaartesanalorganica.com/
Manteigaria ⭐,Breakfast / Café,Pastry,"Rua Alexandre Herculano 56, 4000-055 Porto",Budget (~€1.30),"Reddit's unanimous #1 for standalone pastéis de nata in Porto. Standing counter only — grab a nata straight from the oven, sprinkle cinnamon, eat immediately. Pair with bica",https://www.manteigaria.com/en/
Fábrica da Nata,Breakfast / Café,Pastry,"Rua de Santa Catarina 225, Porto (multiple locations)",Budget (~€1.30),"Reliable less touristy nata café. Consistent quality without hype or queues of Manteigaria. Multiple city-centre locations",https://www.fabricadanata.com/
Aloma 🏆,Breakfast / Café,Pastry,"Porto Airport + city locations",~€1.50,"Multi-award-winning nata — Best Pastel de Nata 2024–2025. Richer, more egg-forward custard than competitors. Airport location perfect on departure day",https://www.aloma.pt/
Tabuleta,Dinner / Lunch,Tasca,"Rua da Conceição area, Porto",€20–30/person,"Classic Portuguese tasca — honest, generous, no shortcuts. The kind of neighbourhood restaurant locals have been eating at for decades. Walk-in; arrive by 7pm",N/A
MUU,Dinner / Lunch,Contemporary Portuguese,"Porto city centre, Porto",€25–35/person,"Contemporary Portuguese with strong focus on quality beef and seasonal local produce. Sleek interior, serious kitchen. Reservations essential — book 1–2 weeks ahead",N/A
Eleit,Dinner / Lunch,Contemporary Portuguese,"Porto city centre, Porto",~€22/person,"Relaxed modern local cuisine. Good value for the quality. Popular with young Porto professionals. Recommended to book",N/A
Taberna de São Miguel,Dinner / Lunch,Tasca / Petiscos,"Near São Miguel church, Porto",€15–22/person,"Traditional petiscos bar. Try tripas à moda do Porto — the dish that earned locals the nickname tripeiros. Walk-in or call ahead",N/A
Restaurante O Rafael,Dinner / Lunch,Seafood,"Matosinhos beach area, Matosinhos",€12–18/person,"Beloved local institution steps from Matosinhos beach. No-frills interior but grilled fish is exceptional — fishermen's catch bought fresh that morning. Walk-in; arrive before noon or 7pm",N/A
Loca,Dinner / Lunch,Creative Seafood,"Porto city centre, Porto",€35–45/person,"Porto's most talked-about creative seafood of 2025–26. Small, exclusive, chef-driven. Menu changes with the catch and season. Book 2–3 weeks ahead — essential in August",N/A
Cobre,Dinner / Lunch,Contemporary Portuguese,"Vila Nova de Gaia (river side, near Dom Luís I Bridge)",€35–45/person,"Contemporary Portuguese in Gaia with terrace offering bridge views over Porto. High-quality ingredients, excellent wine list. Ideal for a special last-night dinner. Book in advance",N/A
Casa da Bifana,Snacks,Street Food,"Near Rua de Passos Manuel, Porto",€2–4,"Porto's iconic bifana stop — pork cutlet in a crusty roll with garlicky wine sauce. The definitive cheap fast Porto street food. Open late. Cash preferred. Eat immediately while hot",N/A
Picha Café,Bar,Cocktail,"Rua da Conceição, Porto",€5–8,"Young locals' favourite bar. Good cocktails at reasonable prices, relaxed atmosphere, standing room inside and out. Where Porto twenty-somethings start their evenings",N/A
Base,Bar,Cocktail,"Near São Bento station, Porto",€7–10,"Cocktail bar near São Bento. Tighter menu than Galeria de Paris bars but consistently well-executed drinks. Good music, compact space. Craft cocktails; seasonal specials",N/A
Bar Clássico,Bar,Local,"Near Rua dos Poveiros area, Porto",€1.50–4,"Old-school Portuguese bar unchanged in 30 years. Cheap, authentic, utterly unpretentious. Mostly local regulars. House wine €1.50/glass. Dirt cheap and utterly authentic",N/A
The Yeatman (terrace bar),Bar,Wine Terrace,"Rua do Choupelo 88, 4400-088 Vila Nova de Gaia",€15–25/flight,"Luxury wine hotel in Gaia with the most spectacular panoramic view of Porto. Open to non-guests. Wine flights (€15–25/person): curated Port + Douro Valley. Arrive before sunset",https://www.theyeatman.com/
Gelataria Portuense,Gelato,Ice Cream,"Rua de Santa Catarina area (central Porto)",€2–3.50,"Classic homemade gelato, natural flavours, fresh Portuguese milk. Top picks: chocolate hazelnut, salted caramel. Small, no-frills, very local feel. One of Porto's most consistent",N/A
NIVÀ Gelato,Gelato,Ice Cream,"Several locations: Time Out Market, Matosinhos, and more",€2.50–4,"Italian roots (founded in the 80s), rich and smooth. Dark chocolate ganache, stracciatella, ricotta with fig. The ricotta & fig flavour is extraordinary",N/A
Neveiros,Gelato,Ice Cream,"Rua do Almada, Baixa, Porto",€3–6,"Porto institution — not just gelato but the city's most creative ice cream parlour. Pistachio affogato (pistachio gelato + hot espresso shot) is the star. Perfect after a morning of churches",N/A
Santini,Gelato,Ice Cream,"Rua de Santa Catarina / Foz, Porto",€2.50–4,"Iconic Lisbon gelateria now in Porto. Ultra-fresh natural flavours. The fresh strawberry (seasonal) and lemon are world-class when in season. Foz location has outdoor terrace",N/A
Cremosi,Gelato,Ice Cream,"Multiple locations across the city",€2–3.50,"Local favourite, very consistent, silky smooth texture, playful flavours. One of the most reliable day-to-day choices in Porto",N/A
DONKO Gelato,Gelato,Ice Cream,"Baixa area, Porto",€3–4,"Opened December 2024 — artisan gelato by a Portuguese-Argentine couple. Very smooth, strong natural flavours of local ingredients. Worth seeking out",N/A
Cremita,Gelato,Ice Cream,"Rua de Cedofeita, Porto",€2.50–3.50,"Handmade ice cream with some of Porto's most creative flavours. Seasonal specials. Cedofeita neighbourhood location is lovely for walking and exploring",N/A